objectid,title,artist,date,description,building,floorroom,location,formatoriginal,dimensions,type,format,value,donor,condition,number,old_objectid,filename,Missing?,display_template,object_location,image_small,image_thumb
campusart355,Country scene,Alfred C. Dunn,,"Painting of a country landscape showing a flowing creek, golden fields, weathered buildings, autumnal trees, and dark distant mountains. The painting is displayed using a tan matter, dark brown trim matte, and a gilt wooden frame.",Alumni Center,offices G08,Alumni Center offices G08,watercolor,"27.5"" x 32.5"" framed",image;stillimage,image/jpg,300,,good,145,194732_OLD_TAGS_099955_&_191303,194732_OLD_TAGS_099955_&_191303.bmp,,image,https://www.lib.uidaho.edu/digital/objects/campusart/194732_OLD_TAGS_099955__191303.jpg,https://www.lib.uidaho.edu/digital/objects/campusart/small/194732_old_tags_099955__191303_sm.jpg,https://www.lib.uidaho.edu/digital/objects/campusart/thumbs/194732_old_tags_099955__191303_th.jpg
campusart356,City Streets,Jess Robert Sanden,2007,Painting depicting dark city street under a bright red sky.,Commons,rm 103 (Mark Miller reports on 12/9/10 this was stolen),Commons rm 103 (Mark Miller reports on 12/9/10 this was stolen),oil painting,"37"" x 31"" framed",image;stillimage,image/jpg,300,Purchased,good,555,194733,194733.bmp,,image,https://www.lib.uidaho.edu/digital/objects/campusart/194733.jpg,https://www.lib.uidaho.edu/digital/objects/campusart/small/194733_sm.jpg,https://www.lib.uidaho.edu/digital/objects/campusart/thumbs/194733_th.jpg
campusart357,Geppetta,Mark Henderson,2006,"Painting showing the torso, neck and jaws of a nude female figure made from 8 canvas cells mounted on a piece of polished wood.",Commons,rm 103,Commons rm 103,oil on canvas w/ wood,"75"" x 27"" x 3.5""",image;stillimage,image/jpg,"1,200",Purchased,good,556,194734,194734.bmp,,image,https://www.lib.uidaho.edu/digital/objects/campusart/194734.jpg,https://www.lib.uidaho.edu/digital/objects/campusart/small/194734_sm.jpg,https://www.lib.uidaho.edu/digital/objects/campusart/thumbs/194734_th.jpg
campusart358,Untitled by Dale Simmons,Dale Simmons,2006,Stoneware platter decorated with the image of a crane and leaves by using a stencil and iron oxide.,Commons,rm 108,Commons rm 108,ceramic,"18.5"" x 21""",image;stillimage,image/jpg,189.12,Purchased,good,557,194735,194735.bmp,,image,https://www.lib.uidaho.edu/digital/objects/campusart/194735.jpg,https://www.lib.uidaho.edu/digital/objects/campusart/small/194735_sm.jpg,https://www.lib.uidaho.edu/digital/objects/campusart/thumbs/194735_th.jpg
campusart359,Untitled by Vinzant Lamay,Vinzant Lamay,2000,"Painting of a floral arrangement of red, pink, and blue flowers in a purple vase. The canvas is displayed in a gold frame.",Commons,rm 300,Commons rm 300,oil on canvas,"44.5"" x 29"" framed",image;stillimage,image/jpg,500,Vincent Lamay,good,558,194736,194736.bmp,,image,https://www.lib.uidaho.edu/digital/objects/campusart/194736.jpg,https://www.lib.uidaho.edu/digital/objects/campusart/small/194736_sm.jpg,https://www.lib.uidaho.edu/digital/objects/campusart/thumbs/194736_th.jpg
campusart360,Katrina: A Tragedy in 5 Acts,Kat Fitzpatrick,2007,Set of five black and white photographic prints 5 that depicts the tragedy of Hurricane Katrina.,Commons,rm 301,Commons rm 301,photographic prints,"20"" x 47"" framed",image;stillimage,image/jpg,505,Purchased,good,559,194737,194737.bmp,,image,https://www.lib.uidaho.edu/digital/objects/campusart/194737.jpg,https://www.lib.uidaho.edu/digital/objects/campusart/small/194737_sm.jpg,https://www.lib.uidaho.edu/digital/objects/campusart/thumbs/194737_th.jpg
campusart361,The Summit,Vangie Jacobs,2003,Painting of two hikers in the woods silhouetted against a bright background. The painting is displayed using red and white mattes and a black frame.,Commons,rm 401,Commons rm 401,watercolor,"42"" x 32.5"" framed",image;stillimage,image/jpg,825,Purchased,good,560,194738,194738.bmp,,image,https://www.lib.uidaho.edu/digital/objects/campusart/194738.jpg,https://www.lib.uidaho.edu/digital/objects/campusart/small/194738_sm.jpg,https://www.lib.uidaho.edu/digital/objects/campusart/thumbs/194738_th.jpg
campusart362,Untitled by Alfred C. Dunn [2],Alfred C. Dunn,,Painting of rocks and brush on a sandy lakeshore. The painting is displayed with a white matte and a silver frame.,Commons,rm 204,Commons rm 204,watercolor,"31"" x 38"" framed",image;stillimage,image/jpg,,,good,561,194739,194739.bmp,,image,https://www.lib.uidaho.edu/digital/objects/campusart/194739.jpg,https://www.lib.uidaho.edu/digital/objects/campusart/small/194739_sm.jpg,https://www.lib.uidaho.edu/digital/objects/campusart/thumbs/194739_th.jpg
campusart363,Untitled by Alfred C. Dunn [3],Alfred C. Dunn,,Painting of white water rafters travelling through rapids with mountain sides and a short falls in the background. The painting is signed by the artist and displayed using a white matte in a silver frame.,Commons,rm 204,Commons rm 204,watercolor,"29.5"" x 33.5"" framed",image;stillimage,image/jpg,,,good,562,194740,194740.bmp,,image,https://www.lib.uidaho.edu/digital/objects/campusart/194740.jpg,https://www.lib.uidaho.edu/digital/objects/campusart/small/194740_sm.jpg,https://www.lib.uidaho.edu/digital/objects/campusart/thumbs/194740_th.jpg
campusart364,Untitled by Alfred C. Dunn [4],Alfred C. Dunn,,Painting of rocks and brush on the shore of a lake. The painting is signed by the artist and displayed using a white matte with a silver frame.,Commons,rm 204,Commons rm 204,watercolor,"31"" x 38"" framed",image;stillimage,image/jpg,,,good,563,194741,194741.bmp,,image,https://www.lib.uidaho.edu/digital/objects/campusart/194741.jpg,https://www.lib.uidaho.edu/digital/objects/campusart/small/194741_sm.jpg,https://www.lib.uidaho.edu/digital/objects/campusart/thumbs/194741_th.jpg
campusart365,Chess game,Chantel Pennington and Darin Harding,2006,Sculpture of mixed media using chess pieces on square ceiling tiles to create a chess game in progress. This was created as a class specific assignment for Art121 in 2006.,Commons,stair 27,Commons stair 27,"sculpture, mixed media",on ceiling,image;stillimage,image/jpg,300,Chantel Pennington and Darin Harding,good,564,194742,194742.bmp,,image,https://www.lib.uidaho.edu/digital/objects/campusart/194742.jpg,https://www.lib.uidaho.edu/digital/objects/campusart/small/194742_sm.jpg,https://www.lib.uidaho.edu/digital/objects/campusart/thumbs/194742_th.jpg
campusart366,WPA mural [1],"Frank Newton, Lester Walker, Mary Talbott Kirkwood",1936,Fresco mural of a man holding a hoe and a woman holding a child in front of a barn and a pair of horses in a landscape of hills and trees.,Commons,rm 103,Commons rm 103,fresco murals,,image;stillimage,image/jpg,"6,000 - 10,000 per David Giese","Frank Newton, Lester Walker, Mary Talbott Kirkwood",good,565,194743,194743.bmp,,image,https://www.lib.uidaho.edu/digital/objects/campusart/194743.jpg,https://www.lib.uidaho.edu/digital/objects/campusart/small/194743_sm.jpg,https://www.lib.uidaho.edu/digital/objects/campusart/thumbs/194743_th.jpg
campusart367,WPA mural [2],"Frank Newton, Lester Walker, Mary Talbott Kirkwood",1936,"Fresco mural of a man in a blue coat surrounded by sweeping colors in front of a landscape of hills, trees, and fields.",Commons,rm 103,Commons rm 103,fresco murals,,image;stillimage,image/jpg,"6,000 - 10,000 per David Giese","Frank Newton, Lester Walker, Mary Talbott Kirkwood",good,566,194744,194744.bmp,,image,https://www.lib.uidaho.edu/digital/objects/campusart/194744.jpg,https://www.lib.uidaho.edu/digital/objects/campusart/small/194744_sm.jpg,https://www.lib.uidaho.edu/digital/objects/campusart/thumbs/194744_th.jpg
campusart368,WPA mural [3],"Frank Newton, Lester Walker, Mary Talbott Kirkwood",1936,Fresco mural showing three students drawing a nude male as a dog rests on the wooden floor.,Commons,stair 27,Commons stair 27,fresco murals,,image;stillimage,image/jpg,"6,000 - 10,000 per David Giese","Frank Newton, Lester Walker, Mary Talbott Kirkwood",good,567,194745,194745.bmp,,image,https://www.lib.uidaho.edu/digital/objects/campusart/194745.jpg,https://www.lib.uidaho.edu/digital/objects/campusart/small/194745_sm.jpg,https://www.lib.uidaho.edu/digital/objects/campusart/thumbs/194745_th.jpg
campusart369,WPA mural [4],"Frank Newton, Lester Walker, Mary Talbott Kirkwood",1936,"Fresco mural showing a man outdoors painting a colorful landscape of forests, hills, and a river.",Commons,stair 27,Commons stair 27,fresco murals,,image;stillimage,image/jpg,"6,000 - 10,000 per David Giese","Frank Newton, Lester Walker, Mary Talbott Kirkwood",good,568,194746,194746.bmp,,image,https://www.lib.uidaho.edu/digital/objects/campusart/194746.jpg,https://www.lib.uidaho.edu/digital/objects/campusart/small/194746_sm.jpg,https://www.lib.uidaho.edu/digital/objects/campusart/thumbs/194746_th.jpg
campusart370,Impact,Arnold Westerlund,,Lithograph depicting a white and orange space object impacting a dark colored planet.,College of A and A Dean's Office,rm 204C,College of A and A Dean's Office rm 204C,lithograph,"19.5"" x 18.5"" framed",image;stillimage,image/jpg,,,fair,569,194747,194747.bmp,,image,https://www.lib.uidaho.edu/digital/objects/campusart/194747.jpg,https://www.lib.uidaho.edu/digital/objects/campusart/small/194747_sm.jpg,https://www.lib.uidaho.edu/digital/objects/campusart/thumbs/194747_th.jpg
campusart371,Untitled by Villone,Villone,,"Print of blotchy forms on a black background bisected by white bands twice. Item has some damage to the glass, paper and smudges on the matte.",College of A and A Dean's Office,rm 204A,College of A and A Dean's Office rm 204A,print,"26.5"" x 27.5"" framed",image;stillimage,image/jpg,,,fair,570,194748,194748.bmp,,image,https://www.lib.uidaho.edu/digital/objects/campusart/194748.jpg,https://www.lib.uidaho.edu/digital/objects/campusart/small/194748_sm.jpg,https://www.lib.uidaho.edu/digital/objects/campusart/thumbs/194748_th.jpg
campusart372,Untitled by Richard Higgs,Richard Higgs,,Mixed media creation forming a black and white round banded image.,College of A and A Dean's Office,rm 202,College of A and A Dean's Office rm 202,mixed media,"43.5"" x 33"" framed",image;stillimage,image/jpg,,,fair,571,194749,194749.bmp,,image,https://www.lib.uidaho.edu/digital/objects/campusart/194749.jpg,https://www.lib.uidaho.edu/digital/objects/campusart/small/194749_sm.jpg,https://www.lib.uidaho.edu/digital/objects/campusart/thumbs/194749_th.jpg
campusart373,John Chapman,John Collias,2008,Portrait of John Chapman drawn using graphite on a cream background. The portrait is displayed with a cream matte in a thin gilt wooden frame.,Admin-Martin Institute,rm 338D,Admin-Martin Institute rm 338D,graphite drawing,"24"" x 19"" framed",image;stillimage,image/jpg,500,John Chapman,good,572,194752,194752.bmp,,image,https://www.lib.uidaho.edu/digital/objects/campusart/194752.jpg,https://www.lib.uidaho.edu/digital/objects/campusart/small/194752_sm.jpg,https://www.lib.uidaho.edu/digital/objects/campusart/thumbs/194752_th.jpg
campusart374,Hill City Elevators,Robert E Higgins,1993,Photograph of dark clouds above the Hill City Elevators using a cream matt in a silver frame.,Prichard Gallery,,Prichard Gallery,photograph (silver gelatin print),"18.25"" x 21.25"" framed",image;stillimage,image/jpg,600,Miriam J Higgins,fair,573,194763_OLD_TAG_188726,194763_OLD_TAG_188726.bmp,,image,https://www.lib.uidaho.edu/digital/objects/campusart/194763_OLD_TAG_188726.jpg,https://www.lib.uidaho.edu/digital/objects/campusart/small/194763_old_tag_188726_sm.jpg,https://www.lib.uidaho.edu/digital/objects/campusart/thumbs/194763_old_tag_188726_th.jpg
campusart375,Untitled by Ted Prichard [2],Ted Prichard,,"Ink painting showing a flower with green leaves, grey petals, and yellow stamens in a peach matte and black wood frame.",Prichard Gallery,Human Resources,Prichard Gallery Human Resources,ink,"22"" x 21"" framed",image;stillimage,image/jpg,350,Richard H. Ross estate,good,574,194764_OLD_TAG_194633,194764_OLD_TAG_194633.bmp,,image,https://www.lib.uidaho.edu/digital/objects/campusart/194764_OLD_TAG_194633.jpg,https://www.lib.uidaho.edu/digital/objects/campusart/small/194764_old_tag_194633_sm.jpg,https://www.lib.uidaho.edu/digital/objects/campusart/thumbs/194764_old_tag_194633_th.jpg
campusart376,Antique Code,Arnold Westerlund,1984,"Black and white print showing floating ""amoeba"" like shapes.",Prichard Gallery,,Prichard Gallery,print,"10.75"" x 10.25"" framed, 6.25"" x 5.75"" image",image;stillimage,image/jpg,400,Barbara Edwards,good,575,194765_OLD_TAG_184060,194765_OLD_TAG_184060.bmp,,image,https://www.lib.uidaho.edu/digital/objects/campusart/194765_OLD_TAG_184060.jpg,https://www.lib.uidaho.edu/digital/objects/campusart/small/194765_old_tag_184060_sm.jpg,https://www.lib.uidaho.edu/digital/objects/campusart/thumbs/194765_old_tag_184060_th.jpg
campusart377,Windy Hill,Arnold Westerlund,,Print using a gradient of green and brown to show a landscape of mountains.,Prichard Gallery,,Prichard Gallery,print,"27"" x 20"" framed, 20.25"" x 20"" image",image;stillimage,image/jpg,300,Barbara Edwards,good,576,194766_OLD_TAG_184063,194766_OLD_TAG_184063.bmp,,image,https://www.lib.uidaho.edu/digital/objects/campusart/194766_OLD_TAG_184063.jpg,https://www.lib.uidaho.edu/digital/objects/campusart/small/194766_old_tag_184063_sm.jpg,https://www.lib.uidaho.edu/digital/objects/campusart/thumbs/194766_old_tag_184063_th.jpg
campusart378,Night Landscape,Arnold Westerlund,,Print showing geometric abstractions in a wooden frame.,Prichard Gallery,,Prichard Gallery,print,"21"" x 20"" framed",image;stillimage,image/jpg,400,Barbara Edwards,good,577,194767_OLD_TAG_184062,194767_OLD_TAG_184062.bmp,,image,https://www.lib.uidaho.edu/digital/objects/campusart/194767_OLD_TAG_184062.jpg,https://www.lib.uidaho.edu/digital/objects/campusart/small/194767_old_tag_184062_sm.jpg,https://www.lib.uidaho.edu/digital/objects/campusart/thumbs/194767_old_tag_184062_th.jpg
campusart379,Abstraction,Arnold Westerlund,1939,Print using the contrast between dark color and light material to depict curvy abstractions.,Prichard Gallery,,Prichard Gallery,print,"14"" x 11"" no frame",image;stillimage,image/jpg,300,Barbara Edwards,good,578,194768_OLD_TAG_184061,194768_OLD_TAG_184061.bmp,,image,https://www.lib.uidaho.edu/digital/objects/campusart/194768_OLD_TAG_184061.jpg,https://www.lib.uidaho.edu/digital/objects/campusart/small/194768_old_tag_184061_sm.jpg,https://www.lib.uidaho.edu/digital/objects/campusart/thumbs/194768_old_tag_184061_th.jpg
campusart380,Untitled by Alfred C. Dunn [5],Alfred C. Dunn,,Painting of a Palouse landscape featuring trees in the foreground with a tractor and hay truck harvesting fields on the rolling hills in the background.,Human Resources,Front desk,Human Resources Front desk,watercolor,"24.5"" x 28.25"" gold frame",image;stillimage,image/jpg,,,good,579,194769,194769.bmp,,image,https://www.lib.uidaho.edu/digital/objects/campusart/194769.jpg,https://www.lib.uidaho.edu/digital/objects/campusart/small/194769_sm.jpg,https://www.lib.uidaho.edu/digital/objects/campusart/thumbs/194769_th.jpg
campusart381,Homunculus,Arnold Westerlund,,Painting with a central object made from predominantly shades of orange andred. Framed using a tan matte.,Prichard Gallery,,Prichard Gallery,print,"27"" x 18"" framed",image;stillimage,image/jpg,,,good,580,194770,194770.bmp,,image,https://www.lib.uidaho.edu/digital/objects/campusart/194770.jpg,https://www.lib.uidaho.edu/digital/objects/campusart/small/194770_sm.jpg,https://www.lib.uidaho.edu/digital/objects/campusart/thumbs/194770_th.jpg
campusart382,Joe Dvorak,Mary Kirkwood,1982,"Portrait Painting of a white bearded man wearing a hat, glasses, and a green jacket seated in front of a shelf stacked with materials.",Prichard Gallery,,Prichard Gallery,oil painting,"38"" x 26.75"" no frame",image;stillimage,image/jpg,,,fair,581,194771,194771.bmp,,image,https://www.lib.uidaho.edu/digital/objects/campusart/194771.jpg,https://www.lib.uidaho.edu/digital/objects/campusart/small/194771_sm.jpg,https://www.lib.uidaho.edu/digital/objects/campusart/thumbs/194771_th.jpg
campusart383,Backstroke Swimmer,Mary Kirkwood,1966,Painting of a man floating on his back in water. Displayed in a wooden frame that has been scratched.,Prichard Gallery,,Prichard Gallery,oil painting,"31.5"" x 46.5"" framed",image;stillimage,image/jpg,,,good,582,194772,194772.bmp,,image,https://www.lib.uidaho.edu/digital/objects/campusart/194772.jpg,https://www.lib.uidaho.edu/digital/objects/campusart/small/194772_sm.jpg,https://www.lib.uidaho.edu/digital/objects/campusart/thumbs/194772_th.jpg
campusart384,The Stillness,Mary Kirkwood,1960,Painting showing a man in black garb lying in repose with two women standing above him.,Prichard Gallery,,Prichard Gallery,oil painting,"37.5"" x 32""",image;stillimage,image/jpg,750,,good,583,194773,194773.bmp,,image,https://www.lib.uidaho.edu/digital/objects/campusart/194773.jpg,https://www.lib.uidaho.edu/digital/objects/campusart/small/194773_sm.jpg,https://www.lib.uidaho.edu/digital/objects/campusart/thumbs/194773_th.jpg
campusart385,Hasmig II,Mary Kirkwood,,Painting of a dark haired woman leaning against a window sill.,Prichard Gallery,,Prichard Gallery,oil painting,"50"" x 35"" framed",image;stillimage,image/jpg,450,James Gipson,good,584,194774,194774.bmp,,image,https://www.lib.uidaho.edu/digital/objects/campusart/194774.jpg,https://www.lib.uidaho.edu/digital/objects/campusart/small/194774_sm.jpg,https://www.lib.uidaho.edu/digital/objects/campusart/thumbs/194774_th.jpg
campusart386,Dressing,Beth Van Holzer,,"Print of a nude male figure viewed from the back. Framed using a cream matte. The print is labeled ""21/35""",Prichard Gallery,,Prichard Gallery,print,"16.25"" x 12"" framed",image;stillimage,image/jpg,,,good,585,194775,194775.bmp,,image,https://www.lib.uidaho.edu/digital/objects/campusart/194775.jpg,https://www.lib.uidaho.edu/digital/objects/campusart/small/194775_sm.jpg,https://www.lib.uidaho.edu/digital/objects/campusart/thumbs/194775_th.jpg
campusart387,Head of Christ,Arnold Westerlund,,"Painting displaying an abstract figure using shades of blue, black, yellow, and green.",Prichard Gallery,,Prichard Gallery,oil painting and car enamel,"32"" x 24.5"" framed",image;stillimage,image/jpg,,,good,586,194776,194776.bmp,,image,https://www.lib.uidaho.edu/digital/objects/campusart/194776.jpg,https://www.lib.uidaho.edu/digital/objects/campusart/small/194776_sm.jpg,https://www.lib.uidaho.edu/digital/objects/campusart/thumbs/194776_th.jpg
campusart388,Campus Directory,Luke Johnson,1997,Abstract image of a phone book created using colored pencils. Displayed in a decorative gold frame.,Prichard Gallery,,Prichard Gallery,colored pencil,"20"" x 19"" framed",image;stillimage,image/jpg,,,good,587,194777,194777.bmp,,image,https://www.lib.uidaho.edu/digital/objects/campusart/194777.jpg,https://www.lib.uidaho.edu/digital/objects/campusart/small/194777_sm.jpg,https://www.lib.uidaho.edu/digital/objects/campusart/thumbs/194777_th.jpg
campusart389,Private Parts,Thomas Miller,1974,Painting of two triangles opposite each other intersecting with two overlapping squares.,Prichard Gallery,,Prichard Gallery,acrylic painting,"33.5"" x 23"" w/ 1/4 wood frame",image;stillimage,image/jpg,,,good,588,194778,194778.bmp,,image,https://www.lib.uidaho.edu/digital/objects/campusart/194778.jpg,https://www.lib.uidaho.edu/digital/objects/campusart/small/194778_sm.jpg,https://www.lib.uidaho.edu/digital/objects/campusart/thumbs/194778_th.jpg
campusart390,Trailing Clouds of Glory Do We Come,Mary Kirkwood,1973,Painting of a nude male child floating among clouds in a dark blue sky.,Prichard Gallery,,Prichard Gallery,oil painting,"25.5"" x 34"" framed",image;stillimage,image/jpg,,,good,589,194779,194779.bmp,,image,https://www.lib.uidaho.edu/digital/objects/campusart/194779.jpg,https://www.lib.uidaho.edu/digital/objects/campusart/small/194779_sm.jpg,https://www.lib.uidaho.edu/digital/objects/campusart/thumbs/194779_th.jpg
campusart391,Pacific Northwest Native American,Unknown,1995,Wood sculpture depicting several forms with eyes looking in different directions.,Commons,rm 104,Commons rm 104,wood,,image;stillimage,image/jpg,500,David Mucci,good,596,194780,194780.bmp,,image,https://www.lib.uidaho.edu/digital/objects/campusart/194780.jpg,https://www.lib.uidaho.edu/digital/objects/campusart/small/194780_sm.jpg,https://www.lib.uidaho.edu/digital/objects/campusart/thumbs/194780_th.jpg
campusart392,Untitled by Arnold Westerlund [1],Arnold Westerlund,,Painting of a boat aground near the shore of a lake with red buildings and mountains visible in the background.,Prichard Gallery,,Prichard Gallery,oil painting,"14"" x 16"" no frame",image;stillimage,image/jpg,,,good,597,194781,194781.bmp,,image,https://www.lib.uidaho.edu/digital/objects/campusart/194781.jpg,https://www.lib.uidaho.edu/digital/objects/campusart/small/194781_sm.jpg,https://www.lib.uidaho.edu/digital/objects/campusart/thumbs/194781_th.jpg
campusart393,Untitled by Arnold Westerlund [2],Arnold Westerlund (possibly?),,Print depicting two nude males. Framed using a white matte.,Prichard Gallery,,Prichard Gallery,print,"10.75"" x 8.75"" wood frame, 5"" x 4"" image",image;stillimage,image/jpg,,,good,598,194782,194782.bmp,,image,https://www.lib.uidaho.edu/digital/objects/campusart/194782.jpg,https://www.lib.uidaho.edu/digital/objects/campusart/small/194782_sm.jpg,https://www.lib.uidaho.edu/digital/objects/campusart/thumbs/194782_th.jpg
campusart394,Ceramic vase by Bobbie Bodine,Bobbie Bodine,1974,"Stoneware vase with parallel grooves and a dark finish. ""UI Grad Student"" is written on the bottom of the vase.",Prichard Gallery,,Prichard Gallery,stoneware,"8.5"" x 6"" x 6""",image;stillimage,image/jpg,50,Estate of Shirley Caldwell,good,599,194783,194783.bmp,,image,https://www.lib.uidaho.edu/digital/objects/campusart/194783.jpg,https://www.lib.uidaho.edu/digital/objects/campusart/small/194783_sm.jpg,https://www.lib.uidaho.edu/digital/objects/campusart/thumbs/194783_th.jpg
campusart395,Ceramic vase by Eric Bander,Eric Bander,1973,Stoneware vase that is bottle-shaped with an under-fired glaze and without much reduction during firing.,Prichard Gallery,,Prichard Gallery,stoneware,"11"" x 6.5"" x 6.5""",image;stillimage,image/jpg,50,Estate of Shirley Caldwell,good,600,194784,194784.bmp,,image,https://www.lib.uidaho.edu/digital/objects/campusart/194784.jpg,https://www.lib.uidaho.edu/digital/objects/campusart/small/194784_sm.jpg,https://www.lib.uidaho.edu/digital/objects/campusart/thumbs/194784_th.jpg
campusart396,Handmade Ceramic Pitcher,Paula Wood,1985,"Handmade porcelain pitcher that has been glazed and reduction fired. Acquired from Lewiston, Idaho.",Prichard Gallery,,Prichard Gallery,porcelain,"8.5"" x 7"" x 5""",image;stillimage,image/jpg,25,Estate of Shirley Caldwell,good,601,194785,194785.bmp,,image,https://www.lib.uidaho.edu/digital/objects/campusart/194785.jpg,https://www.lib.uidaho.edu/digital/objects/campusart/small/194785_sm.jpg,https://www.lib.uidaho.edu/digital/objects/campusart/thumbs/194785_th.jpg
campusart397,Pitcher [2],Pittsfield Potters,,Earthenware pitcher that has been glazed. This pitcher was made in Vermont.,Prichard Gallery,,Prichard Gallery,earthenware,"6"" x 5"" x 4""",image;stillimage,image/jpg,,Estate of Shirley Caldwell,good,602,194786,194786.bmp,,image,https://www.lib.uidaho.edu/digital/objects/campusart/194786.jpg,https://www.lib.uidaho.edu/digital/objects/campusart/small/194786_sm.jpg,https://www.lib.uidaho.edu/digital/objects/campusart/thumbs/194786_th.jpg
campusart398,Pitcher [1],Kennedy,,Stoneware pitcher that has been glazed and reduction fired.,Prichard Gallery,,Prichard Gallery,stoneware,"5.5"" x 5.5"" x 4""",image;stillimage,image/jpg,25,Estate of Shirley Caldwell,good,603,194787,194787.bmp,,image,https://www.lib.uidaho.edu/digital/objects/campusart/194787.jpg,https://www.lib.uidaho.edu/digital/objects/campusart/small/194787_sm.jpg,https://www.lib.uidaho.edu/digital/objects/campusart/thumbs/194787_th.jpg
campusart399,The Canal Bridge,Laurence Stephen Lowry,1949,Painting of people walking across a bridge spanning over a canal in an industrial landscape.,Prichard Gallery,,Prichard Gallery,watercolor,"13.5"" x 17.5"" blue frame",image;stillimage,image/jpg,,Estate of Shirley Caldwell,good,604,194788,194788.bmp,,image,https://www.lib.uidaho.edu/digital/objects/campusart/194788.jpg,https://www.lib.uidaho.edu/digital/objects/campusart/small/194788_sm.jpg,https://www.lib.uidaho.edu/digital/objects/campusart/thumbs/194788_th.jpg
campusart400,Kennard House,Schlaebitz,1896,"Ink drawing of a two story house with a picket fence, sidewalk, and several trees. Framed using green mattes.",Prichard Gallery,,Prichard Gallery,ink drawing,"12"" x 15""",image;stillimage,image/jpg,,Estate of Shirley Caldwell,good,605,194789,194789.bmp,,image,https://www.lib.uidaho.edu/digital/objects/campusart/194789.jpg,https://www.lib.uidaho.edu/digital/objects/campusart/small/194789_sm.jpg,https://www.lib.uidaho.edu/digital/objects/campusart/thumbs/194789_th.jpg
campusart401,Aquarius VII,JoAnn Savage,1970,Lithograph using linoleum with hand applied gold leaf. Framed using a peach matte.,Prichard Gallery,,Prichard Gallery,lithograph,"9.5"" x 11.25"" white wood frame",image;stillimage,image/jpg,,Estate of Shirley Caldwell,good,606,194790,194790.bmp,,image,https://www.lib.uidaho.edu/digital/objects/campusart/194790.jpg,https://www.lib.uidaho.edu/digital/objects/campusart/small/194790_sm.jpg,https://www.lib.uidaho.edu/digital/objects/campusart/thumbs/194790_th.jpg
